Crime ID,Month,Reported by,Falls within,Longitude,Latitude,Location,LSOA code,LSOA name,Outcome type
1e0457b5d66ddde7be43490547e3ddd88463130d87ad8c6b92196e25f56b3c2e,2024-02,Wiltshire Police,Wiltshire Police,-1.776172,51.554744,On or near Belle Vue Road,E01032715,Swindon 019F,Unable to prosecute suspect
3eeb2f3f9e153e819bed450ffff6eae1cbcefe6a62949bcba33049bc9308851a,2024-02,Wiltshire Police,Wiltshire Police,-2.185606,51.259481,On or near Jubilee Close,E01032115,Wiltshire 064A,Unable to prosecute suspect
0bdaaf607a56a8c77827c5f528c1578101a4ea96c020392b36010bd4648e232a,2024-02,Wiltshire Police,Wiltshire Police,-1.774724,51.552934,On or near Brock End,E01015534,Swindon 024B,Investigation complete; no suspect identified
b648f9a28aa4bf4bf32bff9b5a2383a04c9d63963ef19ec4c663d51419496ba6,2024-02,Wiltshire Police,Wiltshire Police,-1.798016,51.572686,On or near Surrey Road,E01015578,Swindon 012B,Investigation complete; no suspect identified
e535c62f3a06213138edc5aa72641ff33646f06432d011f07e5669ebc4463caa,2024-02,Wiltshire Police,Wiltshire Police,-2.251913,51.337504,On or near Spencers Orchard,E01032049,Wiltshire 027E,Investigation complete; no suspect identified
a66fb1e704886a5c23306ce5981aac878887b91f00b03cb598abcd1b4cdfc07b,2024-02,Wiltshire Police,Wiltshire Police,-2.138282,51.372474,On or near High Street,E01032068,Wiltshire 022D,Investigation complete; no suspect identified
c97425e9ed4992299ac47c23a6a9fe6879fa7baff55e520ed0800a83e2154740,2024-02,Wiltshire Police,Wiltshire Police,-1.779385,51.561350,On or near Parking Area,E01032714,Swindon 019E,Unable to prosecute suspect
05b2cab4ec72e0a767d88f2d20dbc43f40dfa87f4f935d033f32315234559f8e,2024-02,Wiltshire Police,Wiltshire Police,-2.151975,51.342856,On or near Sports/Recreation Area,E01032077,Wiltshire 030A,Investigation complete; no suspect identified
7153640854b944b2b16e1d6da524344eda64add89cd0397e17f6a408c050e8ef,2024-02,Wiltshire Police,Wiltshire Police,-2.195078,51.259285,On or near Sycamore Grove,E01032118,Wiltshire 063C,Unable to prosecute suspect
2956757279650e74d8d8c06deaeb28dd4145708b5bcf4ce2586ed1794e6de39e,2024-02,Wiltshire Police,Wiltshire Police,-1.833753,51.601631,On or near Pulsar Road,E01032709,Swindon 026E,Unable to prosecute suspect
970932541654206396c3c48c7177fe1b0d9a119f3e95ecdb2f15a4b03c14505a,2024-02,Wiltshire Police,Wiltshire Police,-1.795554,51.070447,On or near Chipper Lane,E01032014,Wiltshire 056A,Unable to prosecute suspect
ddcc1e3ba0bc2a5fefc91ca7a9434ff1f3a384f332fbdc9b61e4db8c65567077,2024-02,Wiltshire Police,Wiltshire Police,-1.833753,51.601631,On or near Pulsar Road,E01032709,Swindon 026E,Further investigation is not in the public interest
7c2041257a859abbd4557ad89b11b90930a5a7354a23d1e5c38cbbe65d6e7abd,2024-02,Wiltshire Police,Wiltshire Police,-2.004411,51.438023,On or near The Strand,E01031901,Wiltshire 016B,Unable to prosecute suspect
0e9a600c85c47d6c71bf28cf0d7450db75de788b524a97b12c60137f30ee5b71,2024-02,Wiltshire Police,Wiltshire Police,-2.210569,51.319199,On or near Supermarket,E01034534,Wiltshire 031E,Unable to prosecute suspect
4f1c75f7e92974aa1db300923e5834c0cd18ac593b5ddc9f78a8823fa66314e3,2024-02,Wiltshire Police,Wiltshire Police,-1.730882,51.420164,On or near Supermarket,E01031863,Wiltshire 019C,Investigation complete; no suspect identified
e9dc3ff7fda8f4077cd61fad6d44c3ab3e3f018a79ecafe2bbc4713218779cdd,2024-02,Wiltshire Police,Wiltshire Police,-1.744960,51.583022,On or near Bowman Close,E01015553,Swindon 009E,Unable to prosecute suspect
8c01292fb9ba765cafc4efcfebb5113a62d8093a0413836c061619abe275d397,2024-02,Wiltshire Police,Wiltshire Police,-1.805500,51.563734,On or near Montagu Street,E01015579,Swindon 012C,Unable to prosecute suspect
08f168a1fc2d8433a3160247790a713f27d73dcdd3217b91b5d3103f6ae19d84,2024-02,Wiltshire Police,Wiltshire Police,-1.736623,51.514651,On or near The Curnicks,E01015588,Swindon 025F,Investigation complete; no suspect identified
356ff0d1daf45317ca5382530a7aaffbc51c7d98b76b24a48c88d8e3dd441daf,2024-02,Wiltshire Police,Wiltshire Police,-2.140492,51.376311,On or near Shopping Area,E01032062,Wiltshire 022A,Investigation complete; no suspect identified
4352abb7e0ebdf5371f4d19050945b6c0a42a6870477ab2279e044b37dd7a71f,2024-02,Wiltshire Police,Wiltshire Police,-1.796845,51.579661,On or near Holly Close,E01015527,Swindon 007C,Unable to prosecute suspect
7632eae6229bd77e0a0ec4e99406ba1bcf0f458623f6d811f35d7e666785cf62,2024-02,Wiltshire Police,Wiltshire Police,-1.797245,51.068913,On or near St Thomas Square,E01032022,Wiltshire 058C,Unable to prosecute suspect
2d717eaa8253830191daf12761f137d7a0cd731ec3291439f84acb049f05b7cd,2024-02,Wiltshire Police,Wiltshire Police,-1.792533,51.056693,On or near Petrol Station,E01032005,Wiltshire 059A,Investigation complete; no suspect identified
44b35e9011ba9fd6cd79c3a0c5b5268b39406ab2ec6dbc9bad75a3cb4a395d83,2024-02,Wiltshire Police,Wiltshire Police,-2.128333,51.456853,On or near Unity Street,E01031911,Wiltshire 011A,Unable to prosecute suspect
549eccd670bbd70eb18c6030738ad6991d724fd07d9703b75124dbe26e40489d,2024-02,Wiltshire Police,Wiltshire Police,-2.266700,51.092729,On or near The Yews,E01032037,Wiltshire 050D,Unable to prosecute suspect
d58ccc701cd585c0429ed56ade81701a6ab9d2b578639cd36f04d16a330970ab,2024-02,Wiltshire Police,Wiltshire Police,-1.617219,51.253923,On or near Foxtail Gardens,E01034555,Wiltshire 065E,Unable to prosecute suspect
11ff2a857db6b48227efa98d53be5cbf343ccc858f9f4aa70e96fe6d9a464854,2024-02,Wiltshire Police,Wiltshire Police,-1.617219,51.253923,On or near Foxtail Gardens,E01034555,Wiltshire 065E,Unable to prosecute suspect
4202d5d60011d4adc3ec3a916f92c94414a716eee903db93aa2f37a3e4b395a7,2024-02,Wiltshire Police,Wiltshire Police,-1.824084,51.611651,On or near Heygate,E01033842,Swindon 008G,Unable to prosecute suspect
67ce636c14ccfd7ebf4266f102150ea34d0265ebd3e8fc361ac97abe98d93951,2024-02,Wiltshire Police,Wiltshire Police,-2.212436,51.318907,On or near Parking Area,E01034534,Wiltshire 031E,Investigation complete; no suspect identified
25f23774fa67c7f02a58eab442b61a3e5b13a906a92080c6fac51fa53c782da7,2024-02,Wiltshire Police,Wiltshire Police,-1.870458,51.085256,On or near Water Ditchampton,E01032039,Wiltshire 054E,Unable to prosecute suspect
749aab65c98cdc360414eeec6e6fa4e8351c94ed2eccac68e1741b69b0c24e80,2024-02,Wiltshire Police,Wiltshire Police,-1.750727,51.553275,On or near Supermarket,E01015541,Swindon 020D,Unable to prosecute suspect
4ab9b32de0dbe91251fef64e0c1759ec81fda3579cdf65b4b0d25c991b91dbbc,2024-02,Wiltshire Police,Wiltshire Police,-2.147663,51.359011,On or near Kelly Close,E01032070,Wiltshire 021D,Unable to prosecute suspect
ef77f6c3f7d020707bbcfff4c741f4dfe7e53cf3f51473764730eac3d5289efe,2024-02,Wiltshire Police,Wiltshire Police,-2.203828,51.322492,On or near Parking Area,E01032101,Wiltshire 032C,Unable to prosecute suspect
d6a286393f40dd44d7c4b3cee26dd4d7587284cb07f7d0a22e118d0326292bb0,2024-02,Wiltshire Police,Wiltshire Police,-1.826106,51.596459,On or near Markton Close,E01032703,Swindon 026C,Suspect charged
247c088a5bc0d6b44d44b90668c82c46facbefd4a01b694183ed137a864408e6,2024-02,Wiltshire Police,Wiltshire Police,-2.004411,51.438023,On or near The Strand,E01031901,Wiltshire 016B,Unable to prosecute suspect
42d66e2828364d12abd4e5e9e2d3eba57f98c0d08a74f20f6ebb357de9e3efee,2024-02,Wiltshire Police,Wiltshire Police,-2.118597,51.459992,On or near Foghamshire,E01031912,Wiltshire 011B,Unable to prosecute suspect
abedcc950bb944289a87e65e6303cace3e44e42d3c7f58dfa7c1afefb5c7e353,2024-02,Wiltshire Police,Wiltshire Police,-1.833117,51.570035,On or near Cartwright Drive,E01015564,Swindon 014B,Unable to prosecute suspect
ba084c65ee144ad772e88a0f23459171c457607a6f4e281ce8c27b43bf5342a2,2024-02,Wiltshire Police,Wiltshire Police,-2.144525,51.452545,On or near Winchester Close,E01031927,Wiltshire 010G,Investigation complete; no suspect identified
6a3a0a55584743c1de02f6ff0edeb5940abc3cdd23fcccc7c8f6c773fbfbe9fd,2024-02,Wiltshire Police,Wiltshire Police,-1.796302,51.069154,On or near Minster Street,E01032022,Wiltshire 058C,Unable to prosecute suspect
56da62febf5f8f79c5647505f0bc3683276f54df549005e838e81a76ff3f5df9,2024-02,Wiltshire Police,Wiltshire Police,-1.775125,51.550490,On or near Newport Street,E01015534,Swindon 024B,Investigation complete; no suspect identified
d3d60d5be6c883f24ffcbcd9fba6d3414e614a1ff2cde0a22e3e5a316ea82bb9,2024-02,Wiltshire Police,Wiltshire Police,-2.216189,51.314467,On or near Waterworks Road,E01032089,Wiltshire 036B,Unable to prosecute suspect
626cd521a8d68581a2055b6bcbabb4d0e7e0ce643ac24b5415372d5a42b28ec7,2024-02,Wiltshire Police,Wiltshire Police,-1.761879,51.562845,On or near Douglas Road,E01015575,Swindon 016D,Unable to prosecute suspect
946e0b797093f0c814a8c411311a6e1c35ffef189c429034f2a6e39eecc5ede0,2024-02,Wiltshire Police,Wiltshire Police,-1.637471,50.979198,On or near Pound Hill,E01031973,Wiltshire 062A,Unable to prosecute suspect
a64fdd22e9c701ba17fb47b6a9b4d0e61723d50470371919b212bf4ffd2fcdcc,2024-02,Wiltshire Police,Wiltshire Police,-1.832706,51.552510,On or near Irston Way,E01015502,Swindon 022B,Unable to prosecute suspect
aa4c79771fa01ba943c6f9e5340f64a45e669748405db546211a7ad6e1b44318,2024-02,Wiltshire Police,Wiltshire Police,-1.744356,51.559391,On or near Tavistock Road,E01015538,Swindon 016A,Investigation complete; no suspect identified
81891ec4c5042bb359fd5c06db147d795711b3986dde3dc17363f36f5b13c7c6,2024-02,Wiltshire Police,Wiltshire Police,-1.757873,51.553944,On or near Caxton Close,E01015540,Swindon 020C,Unable to prosecute suspect
3a99629b98b1655051dea13a0b84ab4e1a840e3203f9d9b472577560a1b4b3b6,2024-02,Wiltshire Police,Wiltshire Police,-2.189336,51.260239,On or near Abbotts Court,E01032117,Wiltshire 063D,Unable to prosecute suspect
91aba95809e71ee55c8d7270839d50e9de1a648a6fbe8f4ae1d59a54e7563d14,2024-02,Wiltshire Police,Wiltshire Police,-1.747930,51.583666,On or near Frank Warman Court,E01015553,Swindon 009E,Unable to prosecute suspect
3b0a158c4dd05a454d435ede6ea5bb5d9fb1a2524870bdb724c36126a3adad37,2024-02,Wiltshire Police,Wiltshire Police,-2.206405,51.311562,On or near Dunford Close,E01032095,Wiltshire 035D,Unable to prosecute suspect
0c62093478e42ea0d22ce3c5ee176ca247d03db939f8538e93922bdd7b70ae39,2024-02,Wiltshire Police,Wiltshire Police,-2.079112,51.066948,On or near Hill Close,E01032030,Wiltshire 061C,Unable to prosecute suspect
6e28ff76568ed901e9633446058a7c4662b09a2fa022a99df31fc8ee91195f73,2024-02,Wiltshire Police,Wiltshire Police,-2.207869,51.318016,On or near Parking Area,E01034534,Wiltshire 031E,Investigation complete; no suspect identified
caacedc0d387666bc287cd958048894cc599a1b87bfa3a60709b6ff0139f07b1,2024-02,Wiltshire Police,Wiltshire Police,-1.772314,51.077337,On or near Woodland Way,E01032012,Wiltshire 057C,Unable to prosecute suspect
e9ec2e526979b52fc8310dea3c6a7f7b85f463da329bf6601e180ead277cc44c,2024-02,Wiltshire Police,Wiltshire Police,-1.773865,51.551710,On or near High Street,E01015534,Swindon 024B,Unable to prosecute suspect
c02e38c1296dc4654cbff2280000e7b19d7ec0ca04695598714b3dd00b97715b,2024-02,Wiltshire Police,Wiltshire Police,-2.118597,51.459992,On or near Foghamshire,E01031912,Wiltshire 011B,Investigation complete; no suspect identified
5e0fde5c9516f06e436da61385e74765d8374c71a31a4dbd3419aa413abc730c,2024-02,Wiltshire Police,Wiltshire Police,-1.787490,51.549497,On or near The Mall,E01032707,Swindon 021F,Unable to prosecute suspect
c2511a43180848a164c89f1bd4a6d0660115a3196823ad6f14bddb2778982c7a,2024-02,Wiltshire Police,Wiltshire Police,-1.790412,51.068271,On or near Culver Street,E01032022,Wiltshire 058C,Unable to prosecute suspect
9167be450fe93fde292ebd7328cf6f326c614f989b5e92204d0fc0d96850b50c,2024-02,Wiltshire Police,Wiltshire Police,-2.206405,51.311562,On or near Dunford Close,E01032095,Wiltshire 035D,Unable to prosecute suspect
6b38e50c54b45c9566974586faf42f33dbc1e458d6bf352d6e36a34def0737ba,2024-02,Wiltshire Police,Wiltshire Police,-1.748326,51.577292,On or near Birchwood Road,E01015554,Swindon 009F,Unable to prosecute suspect
88677069a43c1c8bec57054e94e8e4bbfa64f5df2b6b89e07482ab50a205f293,2024-02,Wiltshire Police,Wiltshire Police,-1.861004,51.642181,On or near Blythe Close,E01031936,Wiltshire 001D,Investigation complete; no suspect identified
64a755be327c98d6dac2ccf04811fb2ed199e997462cf2bfb6a0ac5b11bf2114,2024-02,Wiltshire Police,Wiltshire Police,-1.733233,51.555777,On or near Supermarket,E01015491,Swindon 023E,Unable to prosecute suspect
ded003fb51cf12083c43dfada521d17bde87def657d9b78c840fa9cbf0731289,2024-02,Wiltshire Police,Wiltshire Police,-1.799446,51.555991,On or near Manor Road,E01015478,Swindon 021A,Unable to prosecute suspect
524cb6e71562beb5fd7b579306e0ab98699158aebbc5c0bb4c64fa6c7534fc38,2024-02,Wiltshire Police,Wiltshire Police,-2.113174,51.455331,On or near Parking Area,E01031917,Wiltshire 011D,Unable to prosecute suspect
6714be5637f9a873f0f113e6096a5ce28f391eeb1aa3dad93778ff111223a6d2,2024-02,Wiltshire Police,Wiltshire Police,-1.729689,51.517467,On or near Dewey Close,E01015588,Swindon 025F,Unable to prosecute suspect
7ddff47c25ba3448856313c727c71bb19dac6d85875a84848e36405175d93f42,2024-02,Wiltshire Police,Wiltshire Police,-1.826685,51.611170,On or near Jekyll Close,E01033842,Swindon 008G,Unable to prosecute suspect
ac075a711cbce2751fe362624e425f9b7ab9024677ad873e5e7faaad5fed8322,2024-02,Wiltshire Police,Wiltshire Police,-1.828692,51.553709,On or near Clare Walk,E01015570,Swindon 022E,Unable to prosecute suspect
8449338000bf98095ae05056020258a2ab6c207198dc1daaa803ad69fc4ac6ef,2024-02,Wiltshire Police,Wiltshire Police,-1.727826,51.515772,On or near Station Road,E01015588,Swindon 025F,Unable to prosecute suspect
e7191b3338c038d06c36c22371b4fb74f3a3f7f6f3b9509a5e3075134e320886,2024-02,Wiltshire Police,Wiltshire Police,-1.790412,51.068271,On or near Culver Street,E01032022,Wiltshire 058C,Unable to prosecute suspect
b856d76a1bef7722224b7b3afb761995e639312523e0ad15b29bb89cfd6fa71d,2024-02,Wiltshire Police,Wiltshire Police,-1.901928,51.535351,On or near Draymans Court,E01031967,Wiltshire 006C,Unable to prosecute suspect
ad2829e8e03ce1ae0af5c37cdb9842c5c5e6ba42eaa4a166d941ce75b27ab60d,2024-02,Wiltshire Police,Wiltshire Police,-1.746783,51.561428,On or near Kenton Close,E01015538,Swindon 016A,Investigation complete; no suspect identified
f95d5d71aed779477893847af5b11ef8849775e493aa7700c9e2f6c2046f8997,2024-02,Wiltshire Police,Wiltshire Police,-1.775569,51.086147,On or near Petrol Station,E01031985,Wiltshire 051B,Unable to prosecute suspect
5e2296a4e6ef6bae716ea66841abb0d1428a297bf5b8132797aa673611526330,2024-02,Wiltshire Police,Wiltshire Police,-1.792533,51.056693,On or near Petrol Station,E01032005,Wiltshire 059A,Investigation complete; no suspect identified
6f13b113dc081e9a8a4948245e4e81fc1bb81a76e784500e4d0368b9f84d9e49,2024-02,Wiltshire Police,Wiltshire Police,-2.174699,51.202336,On or near B3414,E01032105,Wiltshire 042B,Investigation complete; no suspect identified
d7425ccbcc7075ea742689d0e316d8225c9efccd2c4f55870a33d2a00d2cfcec,2024-02,Wiltshire Police,Wiltshire Police,-1.905012,51.542889,On or near Supermarket,E01031967,Wiltshire 006C,Investigation complete; no suspect identified
a162805dd5d10cca97b67158e0c5199e689c080b6d4f863fa7c484c61884a496,2024-02,Wiltshire Police,Wiltshire Police,-1.760860,51.559138,On or near Dudley Road,E01015573,Swindon 016C,Unable to prosecute suspect
cb2ff86e73a8b7f4f9a0ceb50f0838690ad572d43b6de7a919efdbe4e8131f9f,2024-02,Wiltshire Police,Wiltshire Police,-2.251020,51.339601,On or near Parking Area,E01032049,Wiltshire 027E,Unable to prosecute suspect
a44acbe96fd796426d6c31e193900b3dca1354bf6ddc1c5d760364f266162628,2024-02,Wiltshire Police,Wiltshire Police,-1.829879,51.082354,On or near Winding Way,E01031981,Wiltshire 052B,Action to be taken by another organisation
14cc11af349ca51239d3ef3dc1a0aa7e24429caca9627397b8bd368a2481c7c9,2024-02,Wiltshire Police,Wiltshire Police,-1.757276,51.536023,On or near Brettingham Gate,E01033847,Swindon 024E,Local resolution
d9edf08039026cfd31e4860f0abffeaf2a68756ba1011e24a435446a53d5f8f5,2024-02,Wiltshire Police,Wiltshire Police,-1.800008,51.083548,On or near Waters Road,E01032019,Wiltshire 053B,Unable to prosecute suspect
fb6b75f6cbb686a41b3ef36bf55cf28a277a55d328b45c1cf41ca48763f91dca,2024-02,Wiltshire Police,Wiltshire Police,-1.983657,51.338116,On or near Parking Area,E01031855,Wiltshire 026C,Local resolution
4c2b140cbf9c65b21c5a2a0ebd1a359139578c3b3a81315eb18c2ea061fd02af,2024-02,Wiltshire Police,Wiltshire Police,-1.774814,51.162164,On or near Southmill Hill,E01031979,Wiltshire 048F,Unable to prosecute suspect
77b5758edcf5c2095232b66d31f5f6e523081d2e663be0ecba2ff5b552fda476,2024-02,Wiltshire Police,Wiltshire Police,-2.179419,51.319205,On or near Helmsley Road,E01034537,Wiltshire 032G,Unable to prosecute suspect
4465c3faf938fc766785dbff129fc4daa552ee060d94f1f79f3bbab6c1a620fb,2024-02,Wiltshire Police,Wiltshire Police,-2.179419,51.319205,On or near Helmsley Road,E01034537,Wiltshire 032G,Unable to prosecute suspect
9dcd517a6a21c5fa3aa00b1a6de34f1c1a74cd0e7787433487e2ff6e1598e02e,2024-02,Wiltshire Police,Wiltshire Police,-2.196856,51.199646,On or near Park/Open Space,E01032110,Wiltshire 043A,Investigation complete; no suspect identified
316e3ee1ee5859f216814ffd13a9a64e912c59ff53522aa8a3543354ca766e5b,2024-02,Wiltshire Police,Wiltshire Police,-1.798516,51.068744,On or near Bridge Street,E01032022,Wiltshire 058C,Unable to prosecute suspect
c1d1cac5d0721c494e1fb3e332c35637c3a308eb3b30bdd04bf04359d5483f96,2024-02,Wiltshire Police,Wiltshire Police,-2.124152,51.459465,On or near Rudman Park,E01031911,Wiltshire 011A,Unable to prosecute suspect
9cab443b8097c74af1bc8f1f79b6af9812603fdd6ec2a446d1afce88862655a2,2024-02,Wiltshire Police,Wiltshire Police,-1.766498,51.174962,On or near Annetts Close,E01031975,Wiltshire 048B,Investigation complete; no suspect identified
fa85e1aa9ecf265f1485fc3a99a84941737e2bf9d9108b68716417a83ec2613e,2024-02,Wiltshire Police,Wiltshire Police,-2.142335,51.442271,On or near Deere Avenue,E01031931,Wiltshire 018A,Unable to prosecute suspect
cb43a67eb23cf0382334c736dc1d5de74067308af8836881f6c3689416bd5321,2024-02,Wiltshire Police,Wiltshire Police,-1.664437,51.247521,On or near Franklin Close,E01034554,Wiltshire 065D,Investigation complete; no suspect identified
167581002209494c0a99184b1b593af6a714f7782b9750fcb2553e0f160de933,2024-02,Wiltshire Police,Wiltshire Police,-1.773000,51.091780,On or near Bundy Lane,E01031984,Wiltshire 051A,Unable to prosecute suspect
241ec4a57eca2cf48146aefc388eef944ad326f620528970bdd09a5c649f8fcf,2024-02,Wiltshire Police,Wiltshire Police,-1.716479,51.363042,On or near St Andrew's Close,E01031866,Wiltshire 024A,Unable to prosecute suspect
dc7f5a853ef41504f31189cf8d3f413bd0f631ea0e1dbb16f744f0bdf002632e,2024-02,Wiltshire Police,Wiltshire Police,-1.835443,51.553341,On or near Bloomsbury Close,E01015502,Swindon 022B,Unable to prosecute suspect
5e6921739ced0d1add8e4fc1979d436be47d5fa71dab284997c00cd28ad99665,2024-02,Wiltshire Police,Wiltshire Police,-1.784138,51.590428,On or near Westbury Road,E01015543,Swindon 003A,Unable to prosecute suspect
51f5997a5ffc8122e4b005dd14d8e358265bfc5d06878dabc7801f7f4315280b,2024-02,Wiltshire Police,Wiltshire Police,-1.780794,51.592337,On or near Fyfield Avenue,E01015544,Swindon 003B,Investigation complete; no suspect identified
5467532945831c1e618d2d48e35b4b7f14698c0c18d8fa4de93b381b53808c14,2024-02,Wiltshire Police,Wiltshire Police,-1.825493,51.086942,On or near The Valley,E01031982,Wiltshire 052C,Unable to prosecute suspect
2b86680175fd1ccf7132fff2f0e3ebb6d45195f409827a96e9187d8d1a718ddc,2024-02,Wiltshire Police,Wiltshire Police,-2.251913,51.337504,On or near Spencers Orchard,E01032049,Wiltshire 027E,Investigation complete; no suspect identified
8cec3d2d34e82d5b8a24d6bd66214891b10ff5994a1389a203448739dcf40ade,2024-02,Wiltshire Police,Wiltshire Police,-2.113219,51.473674,On or near Bryant Close,E01034523,Wiltshire 013F,Unable to prosecute suspect
17bc8367fa6b8c50667b3875e0f606b9d86c9715bf8044b865d8ff61a5fbcd5a,2024-02,Wiltshire Police,Wiltshire Police,-2.197623,51.261097,On or near Gryphon Close,E01032118,Wiltshire 063C,Unable to prosecute suspect
553522fd60470619477511290ed523e39101e8950791739147c48b441ea17ed6,2024-02,Wiltshire Police,Wiltshire Police,-2.122423,51.373022,On or near Brecon Close,E01032073,Wiltshire 020D,Offender given a caution
e15bc16f10a387d5976f8965ca13f382b1091edabf746910741e1f038d002e42,2024-02,Wiltshire Police,Wiltshire Police,-1.775386,51.585458,On or near Cricklade Road,E01015543,Swindon 003A,Investigation complete; no suspect identified
094eaf142c5ee0def6257b0e56c11f6e156656f54922b5f19cdeb80ff80c3835,2024-02,Wiltshire Police,Wiltshire Police,-2.057653,51.151090,On or near Sutton Hill,E01032076,Wiltshire 047C,Unable to prosecute suspect
70b553d7418b36f1a8dba40d5fd76389df5a9bbc65f4e4af128f6db9ef973ccd,2024-02,Wiltshire Police,Wiltshire Police,-1.659488,51.355040,On or near Wolfhall Road,E01031847,Wiltshire 029B,Further investigation is not in the public interest
c75c8b5ddeefb19f586aba3c25c05be6387c0e607fb7882aa0f44dae35a3af51,2024-02,Wiltshire Police,Wiltshire Police,-2.212630,51.314222,On or near Ashleigh Grove,E01032089,Wiltshire 036B,Unable to prosecute suspect
d909407f59cb558790d04b24b87826be19fa5527c24d691138080a6f953af3a1,2024-02,Wiltshire Police,Wiltshire Police,-1.906254,51.542107,On or near Wood Street,E01031967,Wiltshire 006C,Unable to prosecute suspect
8f852ba0fe78efb713de3fbd9c841c43152d156e7b256a6212b127ddb2d5f07f,2024-02,Wiltshire Police,Wiltshire Police,-1.783492,51.595777,On or near Odstock Road,E01015545,Swindon 003C,Unable to prosecute suspect
57573d2e9516d86965e0c7c83d5c66d52ebe3f0ed651beb38e4d65c933dcaec6,2024-02,Wiltshire Police,Wiltshire Police,-2.251913,51.337504,On or near Spencers Orchard,E01032049,Wiltshire 027E,Investigation complete; no suspect identified
6936cdb3b7da6b9133dfe241978843e03026f5883f2138dd4c07b870d2ad22ab,2024-02,Wiltshire Police,Wiltshire Police,-1.795649,51.068397,On or near New Canal,E01032022,Wiltshire 058C,Investigation complete; no suspect identified
7897f522d70530510fba561faa1a6d5d344c961a2370f2c5dc98b2a2e74272d4,2024-02,Wiltshire Police,Wiltshire Police,-2.180237,51.268040,On or near Sunnybank Road,E01034551,Wiltshire 063A,Unable to prosecute suspect
be0b4f9d985f613a9a394c3b18fc681182f99f9cbf0d3354d00cc78ff00a4a9a,2024-02,Wiltshire Police,Wiltshire Police,-2.142934,51.380920,On or near Supermarket,E01032063,Wiltshire 020A,Investigation complete; no suspect identified
6a2523b62ffdc03078a7059e09660b132ec1210013076f66df51e34dd1edb48c,2024-02,Wiltshire Police,Wiltshire Police,-2.251913,51.337504,On or near Spencers Orchard,E01032049,Wiltshire 027E,Investigation complete; no suspect identified
9811c1ac58e1bd56c2188b86280ef5236c5bdf7406b65467797efe70a874008c,2024-02,Wiltshire Police,Wiltshire Police,-2.195496,51.205747,On or near Were Close,E01032112,Wiltshire 043C,Unable to prosecute suspect
1b031a2a868e2a0ca28332259fcc8027ad36f7136a863e972f61894d79e3a15a,2024-02,Wiltshire Police,Wiltshire Police,-2.195496,51.205747,On or near Were Close,E01032112,Wiltshire 043C,Unable to prosecute suspect
adba7df9d76297ff0a4ed96b58760378b19bccd72b5c1ab7b119892cbf1473f3,2024-02,Wiltshire Police,Wiltshire Police,-2.209415,51.320414,On or near Shopping Area,E01034534,Wiltshire 031E,Investigation complete; no suspect identified
f8a654ab63f1334af7991365a32ee1b437ade3ef58644e021c72ce2f47c1a6c9,2024-02,Wiltshire Police,Wiltshire Police,-1.750727,51.553275,On or near Supermarket,E01015541,Swindon 020D,Investigation complete; no suspect identified
583bdfd42362ca004b582a47089755027af9f556d3bde224212af4e1e7831031,2024-02,Wiltshire Police,Wiltshire Police,-2.185688,51.336351,On or near Hill Street,E01032079,Wiltshire 030C,Unable to prosecute suspect
2a6753a3fd1faa68af9e46a91ca36780dce1535e24e83615d679e9adb3a3c790,2024-02,Wiltshire Police,Wiltshire Police,-2.209886,51.322967,On or near Supermarket,E01034533,Wiltshire 031D,Unable to prosecute suspect
5fb12233efdc803f8c817aa8c042ca8289927ff794f1482ed4bea13f3dd41e74,2024-02,Wiltshire Police,Wiltshire Police,-1.662400,51.238128,On or near Ordnance Road,E01032697,Wiltshire 066C,Unable to prosecute suspect
00e449b0ee71910cd7efa6e23821e70dea0f091705157bd294dc68e5360b133a,2024-02,Wiltshire Police,Wiltshire Police,-1.810567,51.597622,On or near Mazurek Way,E01032710,Swindon 028E,Investigation complete; no suspect identified
dc28ba096aeafd3d3d41e0dd5a388af3512d3192404ba4182833ef189d50ac14,2024-02,Wiltshire Police,Wiltshire Police,-1.786886,51.561517,On or near Queen Street,E01033845,Swindon 015E,Investigation complete; no suspect identified
319e5b4311ca9b9bdef71d45e2a6d74bba5622335953e3d4eb2508cad5e93b62,2024-02,Wiltshire Police,Wiltshire Police,-1.751207,51.567660,On or near Crampton Road,E01015550,Swindon 009B,Unable to prosecute suspect
6d20833c63f9dd16dc5d72d626e63346e584e3b55273bc5fb40866cdff5125c6,2024-02,Wiltshire Police,Wiltshire Police,-2.267271,51.416093,On or near Bath Road,E01031888,Wiltshire 017A,Unable to prosecute suspect
49fd764a73ff67705ebb79a310302f04b2f4e76988d0bab3d7d0e7a6d176b2c9,2024-02,Wiltshire Police,Wiltshire Police,-2.212676,51.324301,On or near Westcroft Street,E01034533,Wiltshire 031D,Unable to prosecute suspect
ea80c642793bb116c0876564ff2ec1031783f83dfda148b17d8ac5e59038313d,2024-02,Wiltshire Police,Wiltshire Police,-2.011403,51.439677,On or near Wansdyke Drive,E01034524,Wiltshire 016E,Unable to prosecute suspect
432b28e407de7afd1fb97e60cd8ba1f9b17de9cd0a56a24d7a89ea37f7c2bba4,2024-02,Wiltshire Police,Wiltshire Police,-1.770123,51.544267,On or near Gosse Court,E01015535,Swindon 024C,Investigation complete; no suspect identified
de5bd6a92cedcb753b0fab82c0c895db891d4187ab93395f9308f17cee34138f,2024-02,Wiltshire Police,Wiltshire Police,-1.792038,51.068499,On or near Nightclub,E01032023,Wiltshire 059D,Local resolution
