Crime ID,Month,Reported by,Falls within,Longitude,Latitude,Location,LSOA code,LSOA name,Outcome type
97ccb54a5cc697d82206cecbdc7c5316a83b0ee12ff26e43f8e915fc129d19f2,2024-02,Wiltshire Police,Wiltshire Police,-1.785302,51.560868,On or near Shopping Area,E01015494,Swindon 019A,Unable to prosecute suspect
bdc3f525c2b992f81682dad4de9deb93f09180c4dbd09fc14f9c40bf96b8f6c9,2024-02,Wiltshire Police,Wiltshire Police,-1.815384,51.097852,On or near New Bottom Road,E01032013,Wiltshire 049A,Unable to prosecute suspect
441315512bf7c9ae7b6341256ba0261db0e46887a44377adfc8a7fb59e3d18d4,2024-02,Wiltshire Police,Wiltshire Police,-1.739101,51.567885,On or near Parking Area,E01015481,Swindon 013A,Unable to prosecute suspect
38a094f437138df851b96e0da92b2546232c187e5ef963e27a69e3bc13ce7920,2024-02,Wiltshire Police,Wiltshire Police,-1.729631,51.554197,On or near Galsworthy Close,E01015491,Swindon 023E,Local resolution
f0251ffbd93ad608e9c29e0fd72186e2c93a2cddbc24bd523808529f9cd42c6b,2024-02,Wiltshire Police,Wiltshire Police,-2.198717,51.335287,On or near Elizabeth Way,E01032079,Wiltshire 030C,Suspect charged
00e8f6a5a3249ebfa241c6ebb1c1bd9d4a6405c2ad24a384a46fdce5876b08ff,2024-02,Wiltshire Police,Wiltshire Police,-2.206083,51.322901,On or near Union Street,E01032101,Wiltshire 032C,Unable to prosecute suspect
9399cf8de1fdd3cde08f3791c02014c38fb3f3e8d1618d11f226cdc179df889e,2024-02,Wiltshire Police,Wiltshire Police,-1.752722,51.551658,On or near Wardley Close,E01015540,Swindon 020C,Unable to prosecute suspect
2e1ef89224d391e30581511e4d737d615c4d708ca942f2c09ad9cd1cf5d933e0,2024-02,Wiltshire Police,Wiltshire Police,-1.758301,51.557469,On or near Further/Higher Educational Building,E01015573,Swindon 016C,Unable to prosecute suspect
833a347ede4bb73103a37d511e847cc78ed6cc59cc04097973c5c1916a73dff8,2024-02,Wiltshire Police,Wiltshire Police,-1.816167,51.598053,On or near Jagoda Court,E01032701,Swindon 027A,Unable to prosecute suspect
e4261e2d5c5b4107574792ade7e39fcfdcb46eb178c4fab229895c56ef4acc27,2024-02,Wiltshire Police,Wiltshire Police,-1.751360,51.579187,On or near Casson Road,E01015552,Swindon 009D,Unable to prosecute suspect
8217f8c4b1f8c47e74b5de3781d4399df702e8360cefd5ca5f6074e75fb9b970,2024-02,Wiltshire Police,Wiltshire Police,-1.723606,51.514678,On or near Petrol Station,E01015588,Swindon 025F,Unable to prosecute suspect
0198d8553a7cfc4462e1c22269f516713440b0329acdf5b0f36d453bc326e260,2024-02,Wiltshire Police,Wiltshire Police,-2.184714,51.319098,On or near Leisler Gardens,E01032102,Wiltshire 032D,Unable to prosecute suspect
5a6ba6533b0de13ffcbfd61ba6bb0879a88f01535abd5e920e5f03654123b86e,2024-02,Wiltshire Police,Wiltshire Police,-1.824811,51.553856,On or near Kirkstall Close,E01015570,Swindon 022E,Unable to prosecute suspect
8a7f18b45fb3df03eeededc554a5253370f31ac2c37aecc7f028d5b1c79f5777,2024-02,Wiltshire Police,Wiltshire Police,-1.807513,51.599379,On or near Petrol Station,E01032710,Swindon 028E,Unable to prosecute suspect
673079d801f3496ec50c90a9a7953998aed5c2d33c30b44aca53309de1c7b76f,2024-02,Wiltshire Police,Wiltshire Police,-1.751496,51.548859,On or near Trinity Close,E01015542,Swindon 020E,Unable to prosecute suspect
8be96114089a804be7fccd99a58024478325ff770c7d95f1fd5fbf9f2b160620,2024-02,Wiltshire Police,Wiltshire Police,-1.761600,51.560992,On or near Somerville Road,E01015573,Swindon 016C,Suspect charged
0957fd6203c726d2805378913a97ef08dfdc394e3502c1dbaa31cfbcfc7ee6ab,2024-02,Wiltshire Police,Wiltshire Police,-1.595177,51.445148,On or near Whittonditch Road,E01031874,Wiltshire 012D,Local resolution
c3dfdcc8444dd74ddc44c85fdda9b58fa6486d956984b244b4c391948d8422ec,2024-02,Wiltshire Police,Wiltshire Police,-1.793854,51.558274,On or near Cambria Place,E01033846,Swindon 015F,Unable to prosecute suspect
0c83378aed969d53a30da1d5414b7c735bdc0f1cd34103c0008923c7417246cd,2024-02,Wiltshire Police,Wiltshire Police,-1.840722,51.549122,On or near Uxbridge Road,E01015503,Swindon 022C,Suspect charged
ca732d51291342a59fb524b952c7b88c01349f257b8df29e55fe22a62ac82454,2024-02,Wiltshire Police,Wiltshire Police,-1.970080,51.489694,On or near Harts Close,E01031937,Wiltshire 013C,Unable to prosecute suspect
5083ed0a7181428dfca016f95c74042c550e42de31dde1f3017fc966576d5ee7,2024-02,Wiltshire Police,Wiltshire Police,-2.113174,51.455331,On or near Parking Area,E01031917,Wiltshire 011D,Unable to prosecute suspect
8a08402b0f454cf4fd03c80094c78a76cd3999069cf5953d2945900e6d5a1467,2024-02,Wiltshire Police,Wiltshire Police,-1.749871,51.550771,On or near Ainsworth Road,E01015541,Swindon 020D,Suspect charged
a601a02f811aa5fc0ead72bc5b7f08f02ef8c4d8eb03adfeaf70906ee0623068,2024-02,Wiltshire Police,Wiltshire Police,-2.103178,51.451735,On or near Bucklands Grove,E01031916,Wiltshire 014A,Unable to prosecute suspect
3f33497ea3ddc2312a3de7cc244149a91c2611122ebc682c1c1126ccd6c58902,2024-02,Wiltshire Police,Wiltshire Police,-1.758565,51.586701,On or near Pinnock's Place,E01015558,Swindon 005D,Suspect charged
6d5be3870da05a70eaacd6530aaa3d8c1cf73126c8a29647950b8dcacb2b1521,2024-02,Wiltshire Police,Wiltshire Police,-1.773865,51.551710,On or near High Street,E01015534,Swindon 024B,Suspect charged
bcb0e951d95ba4dbc18f53d8ad1284020dbf19bca55590124505018e2a6b2c9a,2024-02,Wiltshire Police,Wiltshire Police,-2.203231,52.513724,On or near The Close,E01029645,South Staffordshire 013A,Unable to prosecute suspect
1573e9943081f54149c9422db009a0be2ac053c5e0b6acc5e182d7664a37c717,2024-02,Wiltshire Police,Wiltshire Police,-2.118739,51.359619,On or near Belvedere Road,E01034530,Wiltshire 021I,Unable to prosecute suspect
5186887200439e585d5677b5216e65571da765d98ac869c3fcb720e75b70c9cb,2024-02,Wiltshire Police,Wiltshire Police,-1.761879,51.562845,On or near Douglas Road,E01015575,Swindon 016D,Unable to prosecute suspect
8e9acb3594c2c276cf87474f4766226f1ccae898937d8b209262cbcfeb4647f5,2024-02,Wiltshire Police,Wiltshire Police,-1.746752,51.574861,On or near Winchester Close,E01015549,Swindon 009A,Unable to prosecute suspect
5e1083d3be14f6d248cba03d393580aa583ad62afd39d16366088736e0480567,2024-02,Wiltshire Police,Wiltshire Police,-1.751376,51.557716,On or near Malmesbury Gardens,E01015538,Swindon 016A,Unable to prosecute suspect
91182ad90992e7c7711bab1f35df0608becea568da89752ac32c9c5cb989ee1e,2024-02,Wiltshire Police,Wiltshire Police,-1.779794,51.605193,On or near Kingsdown Lane,E01015473,Swindon 008A,Suspect charged
4498df481cba8795e4be72fdb25c5a5e5b2f2317b89d545972080fb06f746009,2024-02,Wiltshire Police,Wiltshire Police,-1.775348,51.587256,On or near A4311,E01015543,Swindon 003A,Further investigation is not in the public interest
a207b2946b3a9489ba06624990c5070f20db231a947f07f306275f91bf411006,2024-02,Wiltshire Police,Wiltshire Police,-1.803961,51.582829,On or near Lewisham Close,E01015530,Swindon 006D,Suspect charged
9fab6348fd545a2ae076b9e7c9c1ea8c313834d4863bb7c762976817d3bc447b,2024-02,Wiltshire Police,Wiltshire Police,-1.788520,51.579233,On or near Wavell Road,E01015580,Swindon 007D,Suspect charged
0d504a6bef323df5f13c5d7ca60125d4aaf5ba98f5bd191c6fa04ac26e5f1173,2024-02,Wiltshire Police,Wiltshire Police,-1.746712,51.568972,On or near Twickenham Close,E01015550,Swindon 009B,Unable to prosecute suspect
12632f8b45c006c8ecbbbabc2d2032475ad26e1eca36d2e51d2b364e55b57c25,2024-02,Wiltshire Police,Wiltshire Police,-1.841715,51.065043,On or near Netherhampton Road,E01032000,Wiltshire 057A,Unable to prosecute suspect
e11b53cd4075ea296205389cfca6903b1f91fe672c12f15db95dd9a242ccbd16,2024-02,Wiltshire Police,Wiltshire Police,-2.214555,51.311862,On or near Yeoman Way,E01032094,Wiltshire 035C,Unable to prosecute suspect
40d8893cbdfc57976f53f636aa74bd97ad51e613ca8d6293739681bbbf3fa496,2024-02,Wiltshire Police,Wiltshire Police,-1.790412,51.068271,On or near Culver Street,E01032022,Wiltshire 058C,Suspect charged
9636a645745b5b8bb6dc6527df55e45f735624eb6d8b2fcf2d0513399246e944,2024-02,Wiltshire Police,Wiltshire Police,-1.777806,51.559738,On or near Euclid Street,E01015493,Swindon 017B,Suspect charged
3c06201aac559c42d5d3f9471b0dda8c2233568baa08b7a22f9a98d2b7e897b1,2024-02,Wiltshire Police,Wiltshire Police,-2.161146,51.198777,On or near Yeates Field View,E01032104,Wiltshire 042A,Suspect charged
861ec114877a0a78ab2704c406cd10983bdc37e4fd24804e4a44c8b292fb668a,2024-02,Wiltshire Police,Wiltshire Police,-1.779675,51.582076,On or near The Circle,E01015506,Swindon 007A,Unable to prosecute suspect
40d8893cbdfc57976f53f636aa74bd97ad51e613ca8d6293739681bbbf3fa496,2024-02,Wiltshire Police,Wiltshire Police,-1.790412,51.068271,On or near Culver Street,E01032022,Wiltshire 058C,Suspect charged
c431a66062341e55990ca1f8fb7517e70015b2f877ec763d2762a61011703fd1,2024-02,Wiltshire Police,Wiltshire Police,-1.770102,51.566037,On or near Sports/Recreation Area,E01015479,Swindon 017A,Suspect charged
60f12bd5c36ec56b40c7f992bc52a85b2409781050355bd2516eb9da11365a24,2024-02,Wiltshire Police,Wiltshire Police,-1.994600,51.427557,On or near Ebor Gardens,E01031903,Wiltshire 016D,Suspect charged
72fb9e9fa35a1f0218f67b2247d665dc3131e66614db9053bf5e76bd671d42d1,2024-02,Wiltshire Police,Wiltshire Police,-1.762950,51.567792,On or near Wheatcroft Way,E01015479,Swindon 017A,Unable to prosecute suspect
8a66504081b90c2c66946d50cd9566ac047613923f0e5458fcfd70c9fec68df4,2024-02,Wiltshire Police,Wiltshire Police,-1.741206,51.575632,On or near Evergreens Close,E01015550,Swindon 009B,Suspect charged
8da0195f65490bbe7051a0e1e1d2ecf96424e15223da3751ec3a2d612f18b60b,2024-02,Wiltshire Police,Wiltshire Police,-1.662174,51.225961,On or near Normandy Road,E01034558,Wiltshire 066E,Local resolution
cd9648ccd94ebfcdab9df91354a91235dcb90b0336005e4f3c3c8121ddbb8464,2024-02,Wiltshire Police,Wiltshire Police,-1.828704,51.577329,On or near Lomond Close,E01015562,Swindon 011A,Unable to prosecute suspect
734b083d4c6212e2634b88c2f336af07617b0e97e1a24bcebaefe6dd1a76c69b,2024-02,Wiltshire Police,Wiltshire Police,-2.118597,51.459992,On or near Foghamshire,E01031912,Wiltshire 011B,Local resolution
91a016967bc4da0084efe30c89f0b2fbec78810ac21ecb8642d5878c7a4bd412,2024-02,Wiltshire Police,Wiltshire Police,-1.787454,51.563379,On or near Holbrook Way,E01033845,Swindon 015E,Unable to prosecute suspect
91a016967bc4da0084efe30c89f0b2fbec78810ac21ecb8642d5878c7a4bd412,2024-02,Wiltshire Police,Wiltshire Police,-1.787454,51.563379,On or near Holbrook Way,E01033845,Swindon 015E,Unable to prosecute suspect
df76a721deb62407f610eae81d04ab93a3e99198dd6c192818e4ce353678d50d,2024-02,Wiltshire Police,Wiltshire Police,-1.771549,51.564923,On or near Sports/Recreation Area,E01015479,Swindon 017A,Further action is not in the public interest
4c02787b1f0008752e67267d29a72768425a5bfda8242c2d10a4a2769ef524c8,2024-02,Wiltshire Police,Wiltshire Police,-1.989669,51.351452,On or near A342,E01031852,Wiltshire 025C,Unable to prosecute suspect
966338934625d43eb1ed842b9b0c7571d9ff0a832a434a05451833aa3ed1837c,2024-02,Wiltshire Police,Wiltshire Police,-1.828511,51.601776,On or near Phoenix Gardens,E01032703,Swindon 026C,Unable to prosecute suspect
be3d8ab85315a6fe4bc245d0b2e18d6f97e4b9fca4ce5d291d43db23bcbedaf7,2024-02,Wiltshire Police,Wiltshire Police,-1.771301,51.083036,On or near Bishops Mead,E01032012,Wiltshire 057C,Offender given penalty notice
0bd412254d78b8174fa7d341e921908595185d2b3806a99a2f5a69e511a96a23,2024-02,Wiltshire Police,Wiltshire Police,-1.719055,51.580463,On or near Petrol Station,E01015473,Swindon 008A,Suspect charged
6ac7ff71eb45a932cad301304ce8860f195e2d26861909e6de534d80ae038f6c,2024-02,Wiltshire Police,Wiltshire Police,-1.740657,51.045925,On or near The Green,E01031970,Wiltshire 060A,Suspect charged
59136878e81cd5fbb3f739a20b1b9f5e5983da8fa3cb2b984f00c62a731a12cc,2024-02,Wiltshire Police,Wiltshire Police,-1.940382,51.311307,On or near The Croft,E01031883,Wiltshire 034D,Unable to prosecute suspect
630942f0ca58ed6ad2b5f6e2268328569603ec7ee1dec85deeb43de8bc6a0081,2024-02,Wiltshire Police,Wiltshire Police,-1.751496,51.548859,On or near Trinity Close,E01015542,Swindon 020E,Unable to prosecute suspect
720a21c1a6c7a9e40070388274c75a6b67a4f14b66f7b241ace8a25f772789a4,2024-02,Wiltshire Police,Wiltshire Police,-1.658268,51.242882,On or near A3026,E01032697,Wiltshire 066C,Unable to prosecute suspect
081e9ec149985aeb54f4ca117f2b18622362a133de17230abaed5f3a90bf6c9c,2024-02,Wiltshire Police,Wiltshire Police,-1.727200,51.538528,On or near Hospital,E01015547,Swindon 008C,Suspect charged
791e13439e2abced56a31bcb0f68e545d049b9721edaff43e669434ecae4db50,2024-02,Wiltshire Police,Wiltshire Police,-1.807435,51.597446,On or near Supermarket,E01032710,Swindon 028E,Suspect charged
a87d834419923fb3906427a0e0f9b1c2ba7022d8392d3b97afa72f91650820fe,2024-02,Wiltshire Police,Wiltshire Police,-1.830087,51.550735,On or near Alnwick,E01015569,Swindon 022D,Unable to prosecute suspect
d4200d844b9ccb7ea518e7f4872ce0f22367ba011478a002a8ac06f731f13991,2024-02,Wiltshire Police,Wiltshire Police,-1.779593,51.092413,On or near Howes Crescent,E01031984,Wiltshire 051A,Unable to prosecute suspect
13b530c1a69a083bd467cb0f31fac95f5c448d7a677dd2c0f0147bbb7f4c9779,2024-02,Wiltshire Police,Wiltshire Police,-1.746546,51.588573,On or near St Quentin Close,E01015552,Swindon 009D,Suspect charged
c7de02f51ba940bd791402a14092ecb7d2ff4e771151ba5c223cee5a32dc8d8b,2024-02,Wiltshire Police,Wiltshire Police,-1.805855,51.558205,On or near Saltash Road,E01032708,Swindon 012F,Unable to prosecute suspect
53a9bccdd0b6ed0371a9a56e4b9be24a8c9538814eea570a99700c1f58a262fb,2024-02,Wiltshire Police,Wiltshire Police,-2.187461,51.204699,On or near Emwell Street,E01032114,Wiltshire 044D,Unable to prosecute suspect
9c49f69b299627cd7a3128191eb5abe2cef6163d677300dec6dde3ddaa5e4401,2024-02,Wiltshire Police,Wiltshire Police,-1.765165,51.164303,On or near Margarets Close,E01034545,Wiltshire 048H,Suspect charged
5a6ba6533b0de13ffcbfd61ba6bb0879a88f01535abd5e920e5f03654123b86e,2024-02,Wiltshire Police,Wiltshire Police,-1.824811,51.553856,On or near Kirkstall Close,E01015570,Swindon 022E,Unable to prosecute suspect
0957fd6203c726d2805378913a97ef08dfdc394e3502c1dbaa31cfbcfc7ee6ab,2024-02,Wiltshire Police,Wiltshire Police,-1.595177,51.445148,On or near Whittonditch Road,E01031874,Wiltshire 012D,Local resolution
0957fd6203c726d2805378913a97ef08dfdc394e3502c1dbaa31cfbcfc7ee6ab,2024-02,Wiltshire Police,Wiltshire Police,-1.595177,51.445148,On or near Whittonditch Road,E01031874,Wiltshire 012D,Local resolution
b3b3e5bfc16d59123b669c6a80a2c2eb7a270d0e9b8ef49775bc854d5dfd8509,2024-02,Wiltshire Police,Wiltshire Police,-1.873262,51.088191,On or near Philip Road,E01032040,Wiltshire 054F,Unable to prosecute suspect
42b6700b1c427d8c8334cd5eefa76d1ae97fd9ffdbb06905566b842622cc382b,2024-02,Wiltshire Police,Wiltshire Police,-1.786886,51.561517,On or near Queen Street,E01033845,Swindon 015E,Suspect charged
42b6700b1c427d8c8334cd5eefa76d1ae97fd9ffdbb06905566b842622cc382b,2024-02,Wiltshire Police,Wiltshire Police,-1.786886,51.561517,On or near Queen Street,E01033845,Swindon 015E,Suspect charged
da215c6d5abcac9eedd79b517fa3161f30179b60dd10bd0e861192f4e66625a2,2024-02,Wiltshire Police,Wiltshire Police,-1.830918,51.556158,On or near Edington Close,E01015569,Swindon 022D,Unable to prosecute suspect
733ae86433ebb2e5057a46c4e7ba6da32c7058759404bf53bc5cbd925671dd7a,2024-02,Wiltshire Police,Wiltshire Police,-1.812388,51.583086,On or near Edith New Close,E01015528,Swindon 006B,Suspect charged
5af0979c168ae96d3a2969d18acfb97b4ef4645185666144b4b32fc2edffeb9c,2024-02,Wiltshire Police,Wiltshire Police,-1.806225,51.589882,On or near High Street,E01015516,Swindon 004D,Unable to prosecute suspect
4e9a0b194d278e2787dc435e89baeee298bfe64b61db2342fdbfcb7c53452f5c,2024-02,Wiltshire Police,Wiltshire Police,-1.795649,51.068397,On or near New Canal,E01032022,Wiltshire 058C,Suspect charged
f614c8c69b3bbc19a0593b3047cadcb351e29971cbe395687725a40600eecf97,2024-02,Wiltshire Police,Wiltshire Police,-1.799819,51.609086,On or near Diamond Crescent,E01033844,Swindon 008I,Suspect charged
760bb6412b6540f4d8c9b0dbbcdcfdda7e4bb82272fca567006780a3bc534b0d,2024-02,Wiltshire Police,Wiltshire Police,-2.183981,51.265229,On or near The Paddocks,E01032115,Wiltshire 064A,Suspect charged
4883bb358935fd0e6cf84e29a1676131cc24d1e9af32f21084d2016fb3fcaecc,2024-02,Wiltshire Police,Wiltshire Police,-1.750727,51.553275,On or near Supermarket,E01015541,Swindon 020D,Suspect charged
c3a99ac40eb7cbc758ef3f19661f84a114302ee126c4db5910443471572fbba7,2024-02,Wiltshire Police,Wiltshire Police,-1.787154,51.047394,On or near Hospital,E01032000,Wiltshire 057A,Suspect charged
c3a99ac40eb7cbc758ef3f19661f84a114302ee126c4db5910443471572fbba7,2024-02,Wiltshire Police,Wiltshire Police,-1.787154,51.047394,On or near Hospital,E01032000,Wiltshire 057A,Suspect charged
c3a99ac40eb7cbc758ef3f19661f84a114302ee126c4db5910443471572fbba7,2024-02,Wiltshire Police,Wiltshire Police,-1.787154,51.047394,On or near Hospital,E01032000,Wiltshire 057A,Suspect charged
c3a99ac40eb7cbc758ef3f19661f84a114302ee126c4db5910443471572fbba7,2024-02,Wiltshire Police,Wiltshire Police,-1.787154,51.047394,On or near Hospital,E01032000,Wiltshire 057A,Suspect charged
561fe9e8e130f4e2cf171b0e240e254eaa83ab7a74df2a91180942d26ea6a1c5,2024-02,Wiltshire Police,Wiltshire Police,-1.990029,51.349950,On or near Southbroom Road,E01031855,Wiltshire 026C,Local resolution
4af0af40e442badc712379be90ae3e865622375dd910efc6fd3000a08372697e,2024-02,Wiltshire Police,Wiltshire Police,-1.919147,51.082584,On or near Groveley Road,E01032004,Wiltshire 054B,Investigation complete; no suspect identified
bd9fd59932788881d3211bae36dba98ba4acd236a2bde4fce4caa2a79791617d,2024-02,Wiltshire Police,Wiltshire Police,-1.814487,51.602915,On or near Alwyn Court,E01032712,Swindon 027E,Unable to prosecute suspect
20becd924ee803c080cfed79f20bd172854294573307f0c03527c9ebbced2606,2024-02,Wiltshire Police,Wiltshire Police,-1.763561,51.173094,On or near Bugdens Close,E01031978,Wiltshire 048E,Investigation complete; no suspect identified
c8e80a3e13823dfbabce69090704e250ec673d417d215b879545b42c392bae80,2024-02,Wiltshire Police,Wiltshire Police,-1.782422,51.064633,On or near Farley Road,E01032021,Wiltshire 056D,Investigation complete; no suspect identified
6891d845ba3215564a4a4083f13d80976c2a48f1343e17e5c2ddf6bf184a2b4a,2024-02,Wiltshire Police,Wiltshire Police,-1.777801,51.560826,On or near Beckhampton Street,E01015493,Swindon 017B,Investigation complete; no suspect identified
b886daad688919bf853a81e867910888c258d77da357a6fa83e224a181b90714,2024-02,Wiltshire Police,Wiltshire Police,-1.794315,51.600004,On or near Swift Avenue,E01033860,Swindon 028F,Unable to prosecute suspect
007d60b5f8b28b39508881c4131167cd3abde1037959106363d6c9a854e3210f,2024-02,Wiltshire Police,Wiltshire Police,-1.631547,50.979035,On or near Stock Lane,E01031973,Wiltshire 062A,Unable to prosecute suspect
783c7bc74d7150f84b3e2a7bed09a538c34ec33b6b4f225393249fbba55a1460,2024-02,Wiltshire Police,Wiltshire Police,-1.746783,51.561428,On or near Kenton Close,E01015538,Swindon 016A,Unable to prosecute suspect
17b0f243b837f7f70faa2dfe790af0483790a6a0f0bc1842399804601cce5913,2024-02,Wiltshire Police,Wiltshire Police,-1.783231,51.083967,On or near Bishopdown Road,E01031986,Wiltshire 051C,Investigation complete; no suspect identified
f14085d118b916ff7f1bd92f456432a83b9c15a815c5738b8388946b3ce12708,2024-02,Wiltshire Police,Wiltshire Police,-1.790468,51.541733,On or near Culbone Road,E01033848,Swindon 024F,Unable to prosecute suspect
798c0057ce22f024f8e9868f239f03c5a273dc0c0f44533012686c32efd2d5a7,2024-02,Wiltshire Police,Wiltshire Police,-2.228027,51.311684,On or near Westfield Road,E01032096,Wiltshire 033A,Investigation complete; no suspect identified
a565db45305caeb136fb41db36b448c4b343beab63fe2f79c23052653295f786,2024-02,Wiltshire Police,Wiltshire Police,-1.726487,51.041900,On or near Woodlea Grange,E01031971,Wiltshire 060B,Investigation complete; no suspect identified
56b7f90df1a2a3c83468cdf8336dad1f28ded35bc3e467c7141c570f44bf3343,2024-02,Wiltshire Police,Wiltshire Police,-1.996232,51.352288,On or near Theatre/Concert Hall,E01031854,Wiltshire 026B,Unable to prosecute suspect
115234d7b0312b993044879a9abe238ff573d971d97801e28d2f2b2602c9c599,2024-02,Wiltshire Police,Wiltshire Police,-1.773155,51.062916,On or near Supermarket,E01032021,Wiltshire 056D,Investigation complete; no suspect identified
2e10aaa34d5de1b80eaf29ddaaf89dd788e4ccd32a9677ee9497e939bbcf9459,2024-02,Wiltshire Police,Wiltshire Police,-1.784788,51.562772,On or near Parking Area,E01033845,Swindon 015E,Unable to prosecute suspect
67bc1bbf37bf8e4123ccfa48b61c39bd2600ba136b6e0afa36870312c25c77fa,2024-02,Wiltshire Police,Wiltshire Police,-1.785302,51.560868,On or near Shopping Area,E01015494,Swindon 019A,Unable to prosecute suspect
9866b1cf1049ca8d3e26a4a581efc706bddbc2e9c0a7d9eed0822ba04284f572,2024-02,Wiltshire Police,Wiltshire Police,-1.781687,51.565661,On or near Armstrong Street,E01033845,Swindon 015E,Investigation complete; no suspect identified
2c0895db841818486bdcd4591b6fe1685ab9f289df6cbc15712123f44acfb276,2024-02,Wiltshire Police,Wiltshire Police,-1.775344,51.570514,On or near Mervyn Webb Place,E01015510,Swindon 010C,Unable to prosecute suspect
2d2bf66f812b500f1373c29f651076e94a5eea84f3ee00a73c868ccd76097691,2024-02,Wiltshire Police,Wiltshire Police,-1.771142,51.513581,On or near Cosford Close,E01033850,Swindon 025H,Investigation complete; no suspect identified
1589a8e9c4ea570961a8d04a820a1b3857d440ab120db1b91ebb7ccc78f673f2,2024-02,Wiltshire Police,Wiltshire Police,-2.146312,51.448722,On or near Petrol Station,E01031906,Wiltshire 010B,Investigation complete; no suspect identified
64aa6ab07a945f01acdf31d7e0f808ab19e2f2e58d6cbda2364e4a6108703816,2024-02,Wiltshire Police,Wiltshire Police,-1.802663,51.595990,On or near Aden Court,E01015513,Swindon 004A,Unable to prosecute suspect
19680de407bc0dec14b05b86b7a17d98abfc96b10af4f875e20693ec95a3971d,2024-02,Wiltshire Police,Wiltshire Police,-1.762205,51.161456,On or near Haragon Drive,E01031976,Wiltshire 048C,Unable to prosecute suspect
d05fb1da720392dc0a75e6322cffe64ecc139fc5d8be8de0eb96fe206261b715,2024-02,Wiltshire Police,Wiltshire Police,-2.206861,51.320355,On or near Park Road,E01034534,Wiltshire 031E,Investigation complete; no suspect identified
8f5b132ecf6bb5922f5e501a5b3236589599c4a922f09d2ae19a582ab003dc48,2024-02,Wiltshire Police,Wiltshire Police,-1.786886,51.561517,On or near Queen Street,E01033845,Swindon 015E,Suspect charged
b23d0801afb4fecb70a3ee37cfb20913f7bc6a0b6a25821cd0221d01bac67141,2024-02,Wiltshire Police,Wiltshire Police,-2.003725,51.327867,On or near St Mary's Close,E01031872,Wiltshire 028D,Investigation complete; no suspect identified
48a347c1909b23ee468ab57d81a5f3babbc469d7d51948b55669e25e3b603b1e,2024-02,Wiltshire Police,Wiltshire Police,-1.785302,51.560868,On or near Shopping Area,E01015494,Swindon 019A,Unable to prosecute suspect
2fa7182e5654bcd5f07c88bad996354a3c55fe8f6fc9cf6046b203e54655e5cf,2024-02,Wiltshire Police,Wiltshire Police,-1.744076,51.578515,On or near Overton Gardens,E01015554,Swindon 009F,Investigation complete; no suspect identified
f44385d65535e8fabd6b37d64c6553f682ecda4a87dcc9ea982bf23b4ee6a687,2024-02,Wiltshire Police,Wiltshire Police,-2.133138,51.475820,On or near Honeysuckle Close,E01031907,Wiltshire 009A,Investigation complete; no suspect identified
a5053e064a2d96455fa4afc08d36095de8b996f058d4e0f1bc8de3768dabb2bc,2024-02,Wiltshire Police,Wiltshire Police,-1.827559,51.555667,On or near Pevensey Way,E01015569,Swindon 022D,Investigation complete; no suspect identified
145244a446aeac0ce3c0d9809e5a9ba98db1b301c619644eab591d7e01ce0211,2024-02,Wiltshire Police,Wiltshire Police,-1.775386,51.585458,On or near Cricklade Road,E01015543,Swindon 003A,Investigation complete; no suspect identified
b21e0bf973b8390e59e900d9a0526a92fb0b488b00d1cb688d1e761b06395b04,2024-02,Wiltshire Police,Wiltshire Police,-1.790635,51.075843,On or near Churchill Way North,E01032016,Wiltshire 056C,Unable to prosecute suspect
e94712d54f90c97d2b32b7f2f89022022e59012e33a7a4f7f15f6dc8c9f29588,2024-02,Wiltshire Police,Wiltshire Police,-2.032613,51.523950,On or near Dodford Lane,E01034522,Wiltshire 013E,Investigation complete; no suspect identified
a6f3d3e7abc7338a080f2fc6f77fe517013b35e8b7050f08ccf5bd62f0b01556,2024-02,Wiltshire Police,Wiltshire Police,-2.108767,51.454068,On or near Royal Oak Close,E01031917,Wiltshire 011D,Unable to prosecute suspect
a5900d7f4684cc7a76e74a394ab0b4f6533cb8f467ea4516a9a5b45059d9447d,2024-02,Wiltshire Police,Wiltshire Police,-1.775516,51.559050,On or near Groundwell Road,E01032714,Swindon 019E,Suspect charged
1e325f91678f6d75bbf14d379491ff0d4f492ca4afb220d56fbfe5670f800ab3,2024-02,Wiltshire Police,Wiltshire Police,-1.792431,51.553830,On or near Kingshill Road,E01015498,Swindon 021B,Investigation complete; no suspect identified
46eec4f8b0e68a9c348594d325adccc04f84821e4c948b4244e8fba99d354263,2024-02,Wiltshire Police,Wiltshire Police,-1.819179,51.563019,On or near Further/Higher Educational Building,E01015568,Swindon 014D,Investigation complete; no suspect identified
5dab7d9c0632eba935fb9477a35056cc71fc2e6c91858c4c7e5d5a8d5e9792d1,2024-02,Wiltshire Police,Wiltshire Police,-1.844636,51.543247,On or near M4,E01031961,Wiltshire 007E,Investigation complete; no suspect identified
600c4e5887710b191482f3979c1e323404cd2b22d92bba304252baca74b27bd1,2024-02,Wiltshire Police,Wiltshire Police,-1.820419,51.552051,On or near Beaulieu Close,E01015570,Swindon 022E,Investigation complete; no suspect identified
dc01336c655cb62db75b00e9a6a23b54592faa81aa60843f0339710790ac0c4a,2024-02,Wiltshire Police,Wiltshire Police,-1.802663,51.595990,On or near Aden Court,E01015513,Swindon 004A,Offender given a caution
ac95a1e74bd078b883ca54507e10bc8eaa7a9a70b054c2eac05467c3e973ca32,2024-02,Wiltshire Police,Wiltshire Police,-1.708771,51.631482,On or near The Mews,E01015523,Swindon 001E,Unable to prosecute suspect
